<!ELEMENT notas (alumno)>
<!ELEMENT alumno (nombre, curso, asignatura+)>
<!ELEMENT nombre (#PCDATA)>
<!ELEMENT curso (#PCDATA)>
<!ELEMENT asignatura (nombre, notas)>
<!ELEMENT nombre (#PCDATA)>
<!ELEMENT notas (trimestre+)>
<!ELEMENT trimestre (#PCDATA)>
<!ATTLIST trimestre numero CDATA #REQUIRED>
